{
  "$schema": "https://json-schema.org/draft/2020-12/schema",
  "$id": "crane_runway_case_schema_v1.json",
  "title": "Crane Runway Calculation Case V1",
  "type": "object",
  "x-schema-version": "1.0",
  "required": [
    "schema_version",
    "case_id",
    "shape_library_path",
    "base_shape_id",
    "section",
    "span",
    "analysis",
    "crane"
  ],
  "properties": {
    "schema_version": {
      "type": "string",
      "const": "1.0"
    },
    "case_id": {
      "type": "string",
      "minLength": 1
    },
    "description": {
      "type": "string"
    },
    "shape_library_path": {
      "type": "string",
      "minLength": 1
    },
    "base_shape_id": {
      "type": "string",
      "minLength": 1
    },
    "section": {
      "type": "object"
    },
    "span": {
      "$ref": "#/$defs/quantity"
    },
    "analysis": {
      "type": "object"
    },
    "crane": {
      "type": "object"
    },
    "serviceability_limits": {
      "type": "array"
    },
    "stress_limits": {
      "type": "array"
    },
    "rail_eccentricity": {
      "type": "object"
    },
    "warnings": {
      "type": "array",
      "items": {
        "type": "string"
      }
    },
    "metadata": {
      "type": "object"
    }
  },
  "$defs": {
    "quantity": {
      "type": "object",
      "required": [
        "value",
        "unit"
      ],
      "properties": {
        "value": {
          "type": "number"
        },
        "unit": {
          "type": "string",
          "minLength": 1
        }
      }
    }
  }
}
