{
  "schema_version": "1.0",
  "case_id": "without_cover_plate",
  "description": "Variant with cover plate disabled and rail eccentricity enabled.",
  "shape_library_path": "data/shape_libraries/cirsoc_sample_shapes.json",
  "base_shape_id": "CIRSOC_IPN_200",
  "section": {
    "section_id": "ipn_200_with_cover_plate",
    "base_component_id": "ipn_200",
    "base_center_y": {
      "value": 0,
      "unit": "mm"
    },
    "base_center_z": {
      "value": 100,
      "unit": "mm"
    },
    "cover_plate": {
      "enabled": false,
      "element_id": "cover_plate",
      "width": {
        "value": 140,
        "unit": "mm"
      },
      "thickness": {
        "value": 10,
        "unit": "mm"
      },
      "weld_size": {
        "value": 6,
        "unit": "mm"
      },
      "weld_type": "fillet"
    }
  },
  "span": {
    "value": 6,
    "unit": "m"
  },
  "analysis": {
    "movement_step": {
      "value": 250,
      "unit": "mm"
    },
    "station_step": {
      "value": 500,
      "unit": "mm"
    },
    "E": {
      "value": 200000,
      "unit": "MPa"
    }
  },
  "crane": {
    "crane_id": "demo_crane",
    "name": "Demo crane",
    "vertical_impact_factor": 0.25,
    "lateral_force_factor": 0.1,
    "longitudinal_force_factor": 0.0,
    "wheels": [
      {
        "wheel_id": "W1",
        "position_x": {
          "value": 0,
          "unit": "mm"
        },
        "vertical_force": {
          "value": 80,
          "unit": "kN"
        }
      },
      {
        "wheel_id": "W2",
        "position_x": {
          "value": 2,
          "unit": "m"
        },
        "vertical_force": {
          "value": 80,
          "unit": "kN"
        }
      }
    ]
  },
  "serviceability_limits": [
    {
      "limit_id": "L_over_600",
      "type": "span_over",
      "divisor": 600
    }
  ],
  "stress_limits": [
    {
      "limit_id": "0.66Fy",
      "type": "fraction_of_Fy",
      "Fy": {
        "value": 250,
        "unit": "MPa"
      },
      "factor": 0.66
    }
  ],
  "rail_eccentricity": {
    "enabled": true,
    "model_id": "rail_eccentricity",
    "vertical_eccentricity_y": {
      "value": 25,
      "unit": "mm"
    },
    "lateral_load_height_z": {
      "value": 100,
      "unit": "mm"
    },
    "include_vertical": true,
    "include_lateral": true
  },
  "warnings": [
    "CIRSOC sample profile data is manually curated and must be independently verified before production use.",
    "No CIRSOC design-code checks are performed."
  ],
  "metadata": {
    "is_demo": true
  }
}
